{
  "schema_version": 1,
  "skill": "ability:husbandry",
  "base_xp": 20,
  "trigger": {
    "type": "ability:breed_animal",
    "config": {}
  },
  "conditions": [
    {
      "type": "ability:not_game_mode",
      "config": { "game_mode": "minecraft:creative" }
    }
  ],
  "anti_abuse": {
    "reject_player_placed": false,
    "target_cooldown_ticks": 0,
    "daily_soft_cap": 5000,
    "xp_after_soft_cap_multiplier": 0.1
  }
}
