{
  "schema_version": 1,
  "skill": "fantasypower:magic",
  "base_xp": 3,
  "trigger": {
    "type": "fantasypower:enchant_item",
    "config": {
      "minimum_enchantments": 1,
      "minimum_total_levels": 1,
      "scale_by_total_levels": true,
      "maximum_multiplier": 10.0
    }
  },
  "conditions": [
    {
      "type": "fantasypower:not_game_mode",
      "config": { "game_mode": "minecraft:creative" }
    }
  ],
  "anti_abuse": {
    "reject_player_placed": false,
    "target_cooldown_ticks": 0,
    "daily_soft_cap": 5000,
    "xp_after_soft_cap_multiplier": 0.1
  }
}
