{
  "schema_version": 1,
  "skill": "fantasypower:agility",
  "base_xp": 2,
  "trigger": {
    "type": "fantasypower:travel",
    "config": {
      "modes": ["on_foot", "swimming"],
      "minimum_distance": 2.0,
      "maximum_distance": 12.0
    }
  },
  "conditions": [
    {
      "type": "fantasypower:not_game_mode",
      "config": { "game_mode": "minecraft:creative" }
    },
    {
      "type": "fantasypower:not_game_mode",
      "config": { "game_mode": "minecraft:spectator" }
    }
  ],
  "anti_abuse": {
    "reject_player_placed": false,
    "target_cooldown_ticks": 0,
    "daily_soft_cap": 5000,
    "xp_after_soft_cap_multiplier": 0.1
  }
}
