{
  "schema_version": 1,
  "skill": "fantasypower:building",
  "base_xp": 2,
  "trigger": {
    "type": "fantasypower:place_block",
    "config": {
      "minimum_destroy_time": 0.5,
      "scale_by_destroy_time": false
    }
  },
  "conditions": [
    {
      "type": "fantasypower:not_game_mode",
      "config": { "game_mode": "minecraft:creative" }
    }
  ],
  "anti_abuse": {
    "reject_player_placed": false,
    "target_cooldown_ticks": 1200,
    "daily_soft_cap": 5000,
    "xp_after_soft_cap_multiplier": 0.1
  }
}
